ReviewID,OrderMenuID,RatingID,ReviewDate,ReviewBody
890,676,3,2024-04-02,Country issue product couple his unit model deep.
891,878,2,2025-02-09,Partner billion single product year accept under.
892,334,1,2024-05-01,Medical third couple tell white.
893,503,4,2023-02-27,Democratic budget although wish peace enter.
894,825,2,2024-01-28,Reflect by box ok.
895,294,1,2024-08-13,Truth window whom institution situation capital.
896,860,5,2024-12-19,Together become often grow kitchen result.
897,883,5,2025-01-09,Before music yard.
898,867,4,2023-09-08,Somebody response response participant.
899,199,4,2024-11-29,View senior land return event actually cut.
900,604,1,2024-08-26,Many sound article team.
901,418,4,2023-07-01,National front experience billion others wind.
902,501,5,2024-06-22,Line down safe produce call.
903,490,5,2023-12-15,Result majority our yet leave.
904,35,1,2023-09-05,North yet girl do figure collection agreement.
905,326,4,2023-05-14,Upon herself traditional special capital effort sister.
906,267,3,2024-10-22,Study she investment student trade.
907,401,5,2024-10-16,Interesting maintain hospital relate past.
908,839,4,2023-02-25,Yourself head sing different admit.
909,462,2,2023-06-03,Person respond college nature left.
910,207,2,2023-11-21,Big challenge dog lead high.
911,616,4,2023-11-14,Since result it site control.
912,250,2,2024-02-22,Meeting nice general believe test who natural.
913,78,3,2023-03-25,Describe yet worry.
914,402,1,2024-03-05,Brother maybe tend.
915,258,1,2024-12-30,Political social middle real attention have season our.
916,744,1,2024-11-12,Add family good how rest.
917,612,3,2024-12-21,Thought answer despite dinner anyone senior.
918,6,5,2024-10-22,Economic past fight kitchen every perform body.
919,605,3,2024-04-30,Speak play bed identify value sound.
920,969,4,2024-08-29,Any radio on clear.
921,761,5,2023-10-24,East task break maintain summer conference laugh.
922,350,4,2024-02-26,Yeah by certainly effect site strong.
923,278,4,2025-02-03,Pm perform box strategy age Republican.
924,436,1,2024-03-31,Throw example here himself practice position money.
925,916,2,2024-10-22,Perhaps see keep teach we.
926,563,4,2024-04-08,There interest national television beyond oil alone blood.
927,670,3,2024-06-21,Contain work edge animal eye than.
928,546,4,2024-11-11,Tend live want.
929,508,2,2025-03-23,Top direction down church weight information.
930,765,5,2023-03-11,Thousand important make mention pull ask.
931,991,1,2024-06-16,Would age fill experience government.
932,247,5,2025-02-18,Clear power charge later marriage force reason.
933,736,2,2024-08-06,Now player father quickly.
934,677,5,2024-06-13,Design bag husband pretty.
935,52,1,2025-03-17,Reveal long speech matter never.
936,774,2,2024-03-20,Possible account mission imagine.
937,363,4,2023-08-09,Help take majority per animal purpose.
938,530,5,2025-01-04,Hold memory mouth get body letter two cover.
939,992,5,2024-02-29,Case provide real ten establish sometimes decide budget.
940,515,5,2025-02-03,Exist occur field today future we church.
941,440,5,2023-03-22,Check bad size their agency street your.
942,547,3,2023-08-19,Agency heavy choose matter forget in itself.
943,128,2,2024-08-10,Recognize minute one way.
944,60,3,2023-11-30,Place something event anyone safe town.
945,871,5,2024-09-25,City thought window crime push.
946,165,5,2025-01-05,Seat wife or politics.
947,339,1,2023-10-25,Maintain now enough sing because thousand.
948,218,5,2025-03-09,Brother watch some activity serious.
949,97,4,2024-10-14,Difference edge anything continue stop.
950,140,1,2023-12-02,Owner can every later produce condition glass.
951,991,5,2025-03-15,Despite ever deal wall society who.
952,604,3,2024-08-22,Heavy bit alone best produce.
953,821,1,2023-05-19,Institution wide put so agent daughter.
954,181,3,2024-12-22,Result sell floor civil central.
955,433,5,2023-03-08,Exactly foreign sign onto paper any.
956,860,3,2023-04-28,Provide dark system determine.
957,904,3,2024-12-30,Writer treatment those describe forget pull.
958,430,2,2024-07-27,Then teacher side consumer soon contain yet.
959,131,4,2023-12-10,Drive voice stand thing black despite sound.
960,324,2,2025-02-05,Plant increase idea itself campaign doctor most worry.
961,279,1,2024-03-24,Church fear follow capital stage similar page.
962,508,3,2023-06-27,You general note bank stuff free despite minute.
963,797,2,2023-08-24,Full every send adult team.
964,521,4,2024-10-09,Loss difference power necessary support impact.
965,917,4,2023-12-07,Generation successful join worry any officer school.
966,50,2,2024-10-07,Pm first price party project discussion military.
967,703,1,2023-02-22,Without range about common Congress color.
968,34,5,2023-03-31,Tree amount back.
969,578,3,2024-09-25,Store religious no authority.
970,336,3,2023-10-15,House seven threat foot change certain.
971,529,5,2024-04-16,Fire one person kid ask of.
972,53,4,2023-08-07,Once staff open job hit analysis go.
973,314,4,2024-05-21,Save simple family.
974,15,1,2024-05-14,Station why figure low factor others.
975,870,4,2024-08-07,Adult turn shoulder air green.
976,93,1,2024-03-08,Start body business serious detail land.
977,799,4,2023-05-21,Card mission position thousand.
978,301,5,2024-02-15,Pressure discuss push beat another.
979,396,3,2024-11-21,Work hour red worry.
980,126,3,2023-07-21,Personal each world material.
981,852,5,2024-06-01,Study whatever charge.
982,324,1,2025-03-11,It like back such industry memory way.
983,623,3,2024-08-20,Pretty think her create chair return school chair.
984,807,3,2024-01-24,Explain painting clear accept.
985,479,1,2023-12-28,Less entire why specific with outside.
986,788,1,2023-10-27,Collection first population maybe.
987,751,1,2025-02-23,Some few call dark decision.
988,14,3,2024-07-30,Rather gas home help.
989,42,1,2024-09-29,Research would former long.
990,27,4,2024-05-20,Participant allow own either today purpose skin.
991,73,3,2024-11-26,Its cold adult address test save crime.
992,939,4,2024-04-20,Fine language she among.
993,594,1,2024-08-06,Both Congress responsibility soldier.
994,688,2,2023-03-29,Surface them step same cold.
995,57,2,2024-12-25,Race visit enter option language space see.
996,990,1,2024-05-05,Stand organization new treat.
997,911,1,2024-07-21,Social begin impact administration last others wear personal.
998,948,4,2024-10-04,Leave too director still message.
999,36,3,2024-10-08,Exactly staff throughout along into source coach.
1000,462,1,2023-06-07,Language show teach read message.
