ReviewID,OrderMenuID,RatingID,ReviewDate,ReviewBody
444,749,2,2025-02-11,Million evening house economy answer history.
445,297,4,2024-09-07,Concern manage each space.
446,171,3,2023-09-13,Pm system himself and number pressure wait.
447,785,5,2023-01-09,Top official hot parent idea ok maybe official.
448,623,1,2025-01-15,Break subject film.
449,534,5,2023-01-15,Door money deal activity opportunity fact number.
450,317,3,2024-06-17,Leader small product become family behavior ball attorney.
451,820,4,2023-01-19,Experience them itself single it look.
452,67,3,2023-11-28,Often work seven image audience century.
453,2,5,2024-06-11,Help risk others cut together traditional begin.
454,819,1,2024-07-08,Establish scientist number task.
455,306,1,2024-08-29,Central American create.
456,901,4,2024-09-14,Whole fear standard.
457,9,2,2023-01-13,Audience reduce design cell.
458,859,3,2023-12-04,Left age south thus matter find.
459,998,2,2024-11-01,Anyone show property after eat believe.
460,727,1,2024-06-04,Enjoy image protect recently enter each.
461,37,2,2023-02-12,Pretty tend strategy feeling show pressure.
462,223,1,2024-07-13,On reality I development discuss.
463,876,1,2023-05-04,Husband together state play whom member.
464,763,1,2023-10-02,Especially stock positive.
465,164,4,2023-01-17,Always impact to believe.
466,481,4,2023-07-17,Rather market drive data hot support home adult.
467,209,2,2023-08-10,Open certain own author bank smile will service.
468,19,4,2023-10-17,Clearly talk determine dog stand certainly.
469,224,4,2024-12-30,Edge clear expect base baby wide group.
470,771,2,2023-01-26,Sound leader maybe soldier store.
471,131,2,2023-12-15,Role spring market team determine.
472,316,5,2023-02-04,Cut design not deep sign Republican recent.
473,786,3,2024-07-20,Couple color environmental quality tree region fall.
474,537,3,2025-01-28,Remember trip remember herself hear glass occur.
475,179,3,2023-04-26,Yourself large method moment begin must.
476,727,3,2024-12-12,Professor explain book pressure.
477,456,1,2025-01-09,Reveal organization gun beyond.
478,312,3,2023-02-19,Response claim share management ten never.
479,886,1,2023-12-14,Whatever at weight.
480,712,5,2024-01-21,Work world house bag paper.
481,391,3,2024-12-28,Back lawyer investment will direction here very.
482,212,4,2023-08-15,Back sound choice security.
483,767,5,2023-12-16,Threat it herself security at bank because leg.
484,813,4,2024-10-18,Response exist Republican when early.
485,333,2,2024-06-14,Almost front herself decade good.
486,131,2,2025-01-07,Break floor national.
487,700,5,2024-11-04,Skill player office.
488,743,3,2024-03-18,Own glass air.
489,235,1,2025-04-01,Along reason your hard cost.
490,806,1,2024-08-28,Data there any crime myself.
491,350,1,2024-08-27,Affect simply after whatever since.
492,860,5,2023-02-08,Quite subject same goal join admit sell team.
493,424,3,2024-10-11,Indeed finish never rich.
494,83,5,2023-07-08,Whatever brother else center cell shake cell.
495,119,4,2023-04-19,Number course itself fish pay social save.
496,571,1,2025-03-07,Little tough week discuss keep.
497,528,1,2023-08-30,Early human head gas learn call.
498,708,4,2023-03-12,Physical approach movement worker.
499,771,4,2023-04-10,Star prove method certain order foot.
500,155,1,2024-02-25,Along particularly sure find head pretty speech.
501,14,1,2024-12-19,Remember house play claim book role writer bed.
502,989,2,2024-02-29,Cell capital for tough pressure.
503,249,4,2024-08-05,Cell catch build become.
504,855,1,2023-11-07,Generation quite safe take.
505,1000,3,2024-03-04,Majority back happy population detail institution their.
506,554,4,2023-01-23,Cost free save it if certain leave strong.
507,4,5,2023-05-21,Arrive sort enjoy product pass whom reveal.
508,704,1,2024-10-13,Rise turn second.
509,864,1,2023-03-18,Nature wind seek hair shake design attention.
510,440,4,2023-06-14,Sister difference size wrong gas rule run.
511,878,3,2023-10-25,Forward some food base interest.
512,845,5,2024-03-16,Because whole decade cover stop green go.
513,689,3,2024-04-03,Several north outside them ready energy.
514,721,2,2024-03-08,Public analysis know reason girl.
515,738,5,2025-03-05,Professional bank decade after.
516,597,5,2023-09-22,Eat strong owner consumer difference news participant.
517,338,1,2023-05-28,Technology book continue blood whole sign.
518,518,4,2024-06-01,Reason role note become west go.
519,683,2,2023-04-28,In relationship player whom their.
520,423,3,2023-06-02,Value central body along.
521,990,3,2024-12-23,Ten work about.
522,143,1,2024-12-02,Father against business chance church.
523,678,1,2025-01-11,Age describe finish wonder production rule.
524,69,4,2025-01-14,Development some hold all difference.
525,576,4,2023-12-22,Painting present during decade customer position include.
526,343,4,2024-08-02,Might health make girl let.
527,205,5,2024-06-20,Two for fill available including report.
528,941,5,2023-07-14,Spend soldier reach.
529,666,3,2024-02-11,Stage man as expert well into.
530,991,3,2025-03-06,Field how perform.
531,681,4,2023-06-12,Boy performance on collection no sit full.
532,896,2,2023-02-22,Recently station figure quickly hope guy he.
533,66,2,2024-04-13,Coach week sound occur draw rich.
534,728,1,2023-10-01,Herself financial far really.
535,106,4,2024-09-28,Smile poor choice radio election news.
536,97,3,2024-06-05,Safe yet skin ground reduce explain argue.
537,672,1,2024-07-27,Record tell young act several area attack camera.
538,953,2,2025-03-13,Someone challenge consumer feel.
539,168,3,2023-09-27,Few voice sound bill heart represent.
540,515,2,2024-08-21,Above final result stand life opportunity challenge.
541,781,2,2024-12-07,Really including bed resource.
542,81,5,2025-01-11,Goal affect let democratic cause serve financial.
543,478,5,2023-11-25,His beyond to interview.
544,497,2,2024-09-05,Somebody too impact add friend.
545,815,3,2023-03-18,Age program memory may past live which.
546,618,3,2023-06-26,Reach reason write watch.
547,31,3,2024-02-03,Thing way no man.
548,829,1,2023-01-05,Respond including nature skill piece standard remember.
549,962,4,2024-08-15,Standard push positive foreign left receive.
550,215,1,2023-06-02,Throughout wrong stay eight clearly different.
551,653,1,2023-01-01,Attention material big goal.
552,401,1,2023-09-08,Finish happen different fine so as.
553,435,4,2023-08-18,Board return catch seven.
554,395,2,2023-03-22,Minute production gun resource poor maybe good then.
555,403,5,2025-01-11,Serve hope record we nature available majority time.
556,235,5,2023-09-23,Fact cover to down arrive.
557,402,3,2025-02-01,Already agreement increase raise individual drive million.
558,667,1,2024-03-19,Who than forget spring around that key.
559,738,2,2024-01-14,Hard charge base industry.
560,962,2,2024-03-03,Close force tend six best.
561,632,1,2024-12-04,Simple popular serious front.
562,312,3,2023-12-29,About race help rise.
563,492,1,2024-05-22,Office size save country.
564,180,4,2025-01-02,Shoulder house card out wall eye.
565,520,4,2023-05-03,Year attention current respond drug.
566,76,4,2025-02-16,Military onto sister risk.
567,666,1,2024-03-05,Evening manager gas itself natural.
568,253,3,2024-02-05,Bring dog white age then same claim ball.
569,163,5,2023-12-29,Rate network consumer you whom type.
570,425,3,2024-05-17,Produce myself style let church modern certain.
571,975,2,2024-06-08,Left stop foot television standard recently product perform.
572,870,2,2024-10-08,Indeed save to main.
573,335,2,2023-04-09,Also wrong senior section focus though class western.
574,596,1,2023-08-05,After attention Mrs adult.
575,528,4,2023-01-24,Behavior travel follow after teacher single kind.
576,287,1,2023-10-20,Collection develop number design include project.
577,345,3,2024-08-11,Law Mr radio good.
578,11,4,2024-09-30,Bit behind everything although name accept ball use.
579,198,5,2023-12-20,Memory stuff example possible.
580,206,3,2023-02-28,Lay happen popular Congress loss.
581,701,3,2023-11-07,Last into across drop follow foreign scientist.
582,504,3,2023-08-29,Notice pass live drug certainly really environmental.
583,626,1,2024-05-28,Film alone the role down available.
584,51,2,2024-08-06,Not want attack read step.
585,735,5,2024-11-22,Can tax wide poor.
586,178,5,2025-02-10,Certainly enter pay low.
587,684,2,2024-02-10,Next night usually speak job finish sport.
588,680,3,2023-10-25,But affect event.
589,616,5,2024-10-26,Mrs film thousand series.
590,285,2,2023-04-13,Still where personal member chair employee drop.
591,32,2,2024-02-12,Break perform hard word free structure determine.
592,853,1,2023-10-05,Meeting song pass store call nice smile.
593,231,2,2023-12-27,Inside PM partner cut final try.
594,503,5,2023-02-10,Food little heart important instead short hear.
595,370,5,2024-06-25,Position century parent everyone tax.
596,224,1,2024-01-30,Record dream memory guess theory keep.
597,354,3,2023-05-28,Blood buy we action ball tax left push.
598,649,2,2025-01-11,Machine themselves instead him report true.
599,706,1,2024-12-24,Sport government one on fall record.
600,203,5,2024-07-31,Act we enough.
601,683,5,2023-11-27,Include discussion early place program develop.
602,761,3,2023-07-14,West pick analysis education how morning bit.
603,111,2,2025-03-24,Test school benefit.
604,676,1,2023-05-14,Candidate stage visit I note book.
605,206,4,2025-02-26,Pass author discuss speak yourself party forward with.
606,160,4,2023-05-11,Sort not head woman order together admit.
607,728,5,2023-08-20,Forget kid far brother thus across sound.
608,257,1,2023-01-24,One form improve hand customer.
609,758,1,2024-04-28,Close network capital air realize loss.
610,352,2,2023-06-01,Meet professor loss worry table.
611,130,4,2023-10-05,We resource offer.
612,866,5,2025-01-14,Imagine senior use.
613,706,4,2024-07-19,Want finish or glass.
614,459,2,2024-05-15,Politics about long TV some local.
615,976,3,2024-01-30,Beautiful blue high who listen moment sport.
616,706,1,2023-09-18,Include speak find.
617,338,3,2023-04-07,Crime dream music question of.
618,425,1,2023-07-10,Whose front someone onto.
619,463,4,2024-02-28,Same cell improve trade past address no artist.
620,851,2,2023-04-12,Rock arrive option song.
621,101,2,2023-08-11,Common happen nor including generation success fund behind.
622,597,3,2024-11-16,Look way minute production consumer cause.
623,647,5,2024-08-05,Myself fish current very summer shoulder.
624,351,1,2024-01-08,Center soon small control since.
625,49,2,2025-03-08,Clear else film myself short.
626,833,5,2024-01-07,Mean national perhaps mind staff likely.
627,826,3,2024-05-16,Small allow popular list large push her.
628,849,2,2023-09-15,Ago now already style bring read.
629,803,1,2023-11-25,Husband partner recently discuss performance leg marriage.
630,750,2,2024-07-11,Believe serve bed development million tell keep.
631,256,2,2024-02-11,Production degree others science.
632,56,3,2023-05-02,Stop resource true quite bag type.
633,379,1,2024-05-31,Account natural position end prevent.
634,413,2,2025-02-02,Program glass group shoulder standard network.
635,514,4,2023-01-14,Under from edge discuss opportunity born head.
636,466,3,2024-12-05,Open cell course need.
637,569,5,2023-11-27,Arrive section image dog.
638,64,4,2024-05-31,Onto single development base happy.
639,468,2,2023-07-24,Oil page bill cover.
640,809,2,2024-08-13,Paper hear everybody prepare program themselves television.
641,69,5,2023-09-09,Detail here through feeling feel follow visit.
642,129,2,2023-11-16,Until sometimes the ahead shoulder participant.
643,718,5,2023-02-07,Community poor remain three.
644,879,3,2024-06-14,Listen free cause.
645,792,3,2023-08-13,Collection agree important.
646,408,1,2024-01-13,Professor quickly east bed indicate full.
647,338,2,2023-10-05,Stock take travel meet free theory subject.
648,156,4,2024-10-10,Left leader better second.
649,291,4,2023-10-13,Father full hit pretty together process.
650,870,3,2023-05-25,Assume tax participant drive.
651,875,3,2024-11-22,Street table six such information eat stay.
652,638,2,2024-10-16,Now national budget coach blood a job sign.
653,300,5,2024-04-30,Vote drop think especially oil note stage.
654,815,5,2024-06-11,Light successful person partner.
655,555,5,2024-06-27,Big identify bill difference hundred strategy.
656,619,3,2023-12-28,Pressure doctor contain beat.
657,74,2,2024-08-01,Effort small war since.
658,513,5,2024-07-12,Goal role area court six rise.
659,365,3,2024-06-06,Pressure real reality wonder but those.
660,164,5,2023-05-08,Letter TV win see.
661,819,1,2024-08-26,Many economic poor including allow.
662,741,2,2023-06-26,Almost stop sort down notice ready throughout.
663,614,2,2023-01-16,Laugh act partner school.
664,980,1,2024-03-19,Once already blood after miss.
665,518,5,2024-09-18,General report sea sit nearly shake seven market.
666,244,4,2024-01-28,Somebody let factor.
667,520,3,2024-01-17,Owner fill or product.
668,515,1,2024-01-26,Safe during book certainly its offer entire.
669,922,3,2024-09-19,Situation soon worry security figure.
670,174,5,2023-07-20,Surface energy treatment bank night their.
671,932,4,2023-07-02,Writer themselves general like during wrong.
672,5,2,2024-01-15,Bring good lead admit bag election.
673,929,2,2024-11-11,Everything media without note sea common.
674,731,5,2024-09-04,Cell describe event threat.
675,76,1,2024-02-29,Back friend sister little gun decade.
676,336,5,2023-05-26,Health surface purpose small year.
677,124,3,2024-04-14,Here money add reveal sense.
678,284,1,2024-03-22,Later conference administration practice city instead.
679,602,3,2024-12-05,Inside fact two time vote help.
680,479,1,2023-06-17,Score wall this author miss work town.
681,453,3,2023-05-23,As main air top.
682,509,5,2023-09-03,Marriage identify music economic eight win final.
683,424,4,2024-02-29,Citizen remember human no.
684,275,1,2024-07-05,Guess individual report finish.
685,589,3,2023-08-30,Week child people thing none war huge.
686,92,5,2023-03-26,Produce law at information need senior.
687,252,1,2023-06-28,Around leave might sometimes there audience when radio.
688,410,3,2024-04-26,Family she away good lawyer could cost.
689,744,1,2023-12-15,Business determine have resource since tree any watch.
690,87,5,2023-08-25,Information tax card the federal clearly.
691,419,2,2023-09-18,Mouth two feeling.
692,878,2,2023-05-06,Respond responsibility main these.
693,361,4,2024-06-29,Animal professor your box policy.
694,452,4,2023-07-30,Turn center effect care husband represent.
695,424,2,2024-09-19,May yourself food along need.
696,860,1,2025-01-27,Network involve population everything.
697,355,1,2024-09-13,Should chance whatever give attention woman.
698,141,5,2024-12-21,Health voice far strategy.
699,521,1,2025-02-09,Challenge read box level carry what treat.
700,924,4,2023-12-19,Rise outside top about.
701,171,3,2023-12-14,Final around quality discover church research.
702,982,3,2024-10-12,Behavior man rich from need mouth.
703,138,3,2024-04-26,Nor resource benefit choice seem here adult three.
704,721,4,2024-07-28,Understand push voice put program few lead nature.
705,970,5,2025-02-05,Picture every or might join here open.
706,825,2,2025-03-08,Specific voice Mrs food throughout.
707,769,5,2023-02-03,Record democratic class business into difference.
708,397,1,2023-06-14,Teacher they understand less cell cup never.
709,112,1,2025-03-13,Remain start back move.
710,860,4,2023-05-18,War minute rather agreement indeed walk.
711,582,1,2024-06-10,Quickly specific skin end.
712,672,4,2023-01-19,Party television difference toward trial.
713,336,3,2023-04-01,Ten once situation moment appear spring why.
714,673,1,2024-04-10,Decade commercial image.
715,276,1,2024-05-24,Even yourself hotel modern because blood week section.
716,726,2,2023-03-24,Above everyone picture effect world answer whatever.
717,952,3,2024-11-25,Way stuff responsibility perhaps third soldier compare second.
718,578,3,2023-01-28,Finally answer finally member stay today race from.
719,683,4,2024-03-06,Bad huge more friend treatment.
720,835,5,2023-05-14,Congress let low beyond country.
721,25,5,2024-07-31,Nice body audience specific wall black response happy.
722,911,3,2023-10-31,Work ready home onto.
723,878,5,2024-01-07,Group take center.
724,980,4,2023-01-19,Read candidate network.
725,135,3,2023-05-17,Feel anyone everyone card option.
726,577,4,2025-02-05,Worry approach realize design task evening however especially.
727,313,2,2024-01-31,Tonight food so science ten brother.
728,576,4,2024-11-07,I name data thank nature bag.
729,877,3,2025-02-15,Everything choose effort group as president activity.
730,270,3,2024-08-08,Bank ready gas alone.
731,595,5,2023-10-21,Human miss either open catch meet.
732,798,4,2023-10-01,Four south include air field play today.
733,304,4,2024-04-10,Research your off local early care student.
734,195,4,2023-08-17,Mean pay suffer already.
735,688,1,2025-03-06,Future structure friend go.
736,873,4,2024-01-09,Law ball stop account.
737,763,2,2024-11-13,Develop at director purpose night also why.
738,834,2,2023-08-07,Network sit Republican ground send hour.
739,263,4,2023-10-12,Responsibility player local nor task represent smile.
740,759,4,2023-04-08,Tend teacher child those tell leader.
741,879,1,2024-10-19,Experience ten goal for.
742,328,3,2023-10-16,Now put visit series will green have kind.
743,470,4,2024-12-14,Others increase black.
744,492,3,2023-09-10,Lose time environmental appear something however important.
745,854,1,2024-09-28,Necessary list chair similar necessary seek cover.
746,829,2,2023-03-16,Level task seem beat.
747,420,1,2023-02-01,Down industry free they practice tell.
748,885,5,2025-01-30,Grow bank among today where.
749,405,1,2023-08-11,Wait let officer nothing threat.
750,79,5,2023-07-10,Ten energy purpose play stay.
751,740,1,2023-09-02,Building stock toward month.
752,903,2,2025-01-23,Science begin the concern program person believe.
753,244,4,2024-12-18,He leader game support use.
754,941,5,2023-05-07,Wear dog market visit interesting professional.
755,556,5,2024-06-25,Picture color my.
756,549,2,2024-03-17,List its red song ten continue.
757,865,5,2024-11-09,Another move anyone international.
758,448,2,2025-02-05,Party daughter force trip Mr watch.
759,352,3,2024-03-13,Special the everything whose player.
760,641,2,2024-04-24,Bag understand indeed study third box edge.
761,349,5,2024-08-09,Size mother firm technology into environment consider seem.
762,17,5,2024-10-14,Game manage product benefit.
763,796,3,2023-02-21,Camera large most set.
764,755,1,2024-03-10,He already rise go.
765,980,3,2024-03-08,Sometimes first wait order measure probably group.
766,903,2,2024-10-17,Property less treat prove.
767,938,5,2024-05-13,All general growth thank.
768,35,2,2025-02-01,Add feeling friend rate.
769,725,3,2023-09-21,Pass black area whatever.
770,917,1,2024-04-26,Energy tree collection information heart over cover.
771,597,4,2024-05-08,Impact much north bag business two.
772,872,1,2024-10-23,Music parent husband season hand across wrong.
773,93,2,2024-10-11,Final visit enjoy she.
774,715,4,2023-05-20,Floor executive citizen international find citizen stuff.
775,377,5,2025-02-08,General would just yard several body sell.
776,609,3,2023-02-22,Summer involve drug explain high.
777,355,4,2024-12-30,Music even buy that rich five fight.
778,738,4,2023-04-10,Become health single better.
779,410,3,2023-03-23,Almost sit police serve season performance.
780,763,2,2024-11-08,Assume room sure respond what best enough person.
781,455,4,2023-03-04,Adult evening security reason become.
782,528,4,2023-10-30,Unit line hospital difference either authority week.
783,193,5,2023-01-02,Power none suffer interesting until impact.
784,146,3,2024-07-18,Direction power line card phone.
785,969,5,2023-08-24,Issue dog class do.
786,214,1,2024-06-05,Parent ball fly actually reason task start.
787,578,2,2023-09-14,Speech alone left room popular.
788,714,1,2023-09-10,Herself politics require control who.
789,667,4,2025-01-29,Walk one soon.
790,997,2,2024-04-24,Democratic approach life plan early.
791,760,4,2024-07-25,Commercial treat president act one surface edge.
792,804,4,2023-06-27,Dinner education either organization leg result.
793,783,5,2024-02-08,Some behavior point mean not.
794,374,1,2023-01-19,Word pick mother home material scientist.
795,983,4,2025-03-22,Science news allow respond yeah room.
796,959,3,2023-03-28,No go training whether.
797,775,2,2024-10-19,Bill recently media officer beautiful whether almost enough.
798,606,3,2024-07-13,President pay through wife say fight manage.
799,775,5,2024-04-02,Right ten buy.
800,193,1,2024-04-25,Maintain toward Mr responsibility.
801,393,2,2024-12-29,Season occur also many worker remain name election.
802,827,3,2024-05-02,Eight language leave already audience six cut.
803,16,2,2025-03-15,However stock base enough thousand task.
804,946,4,2024-09-27,Senior today individual before better necessary.
805,120,4,2025-02-10,Trouble foot which his action.
806,594,3,2023-12-21,Have their local social.
807,799,2,2024-10-21,Official adult employee finish boy war raise.
808,292,5,2023-08-16,Behind brother above perform stuff memory great.
809,90,5,2023-07-12,Drug free human hour development former movie.
810,158,2,2025-02-03,Glass move develop exactly dog party.
811,653,5,2023-10-17,Very matter detail much woman.
812,471,2,2023-05-26,Way half her stay nearly understand must.
813,32,1,2023-05-17,Guess college four great military life woman.
814,426,2,2023-11-29,Man movie hear everybody group.
815,393,5,2023-08-05,That technology enough policy.
816,109,3,2024-08-28,Raise per month next large finish.
817,576,2,2023-08-20,Source garden both structure.
818,794,5,2024-09-22,Technology mother institution particular recent much.
819,336,3,2023-05-13,Wish education study.
820,688,2,2023-05-18,Information opportunity establish foot Congress figure.
821,236,4,2023-09-28,All think else expect to.
822,420,1,2023-05-12,Future able across contain send piece face.
823,36,5,2024-01-04,Serious standard big.
824,723,5,2025-02-21,Field experience my debate raise first today.
825,544,3,2024-05-19,Chance most brother throw ago market operation.
826,505,2,2024-05-03,During owner cup.
827,548,2,2024-04-06,Treatment ever choose all tree fire everyone.
828,43,5,2025-02-27,Pull town serve election contain environment.
829,959,5,2023-07-05,Dinner process TV free expert determine none husband.
830,449,4,2024-04-11,Four bit miss property.
831,140,2,2024-04-12,Analysis seven thousand there other.
832,1,3,2023-09-16,Finally though life need my.
833,685,1,2024-01-06,Whatever money toward fund buy type yet.
834,144,1,2024-04-01,Current star attention sell impact.
835,30,1,2024-11-21,Soon word it role imagine cover.
836,925,3,2023-12-14,Want ago after.
837,879,5,2023-02-19,Recognize blue western consumer whole daughter idea.
838,925,5,2023-06-18,Ability yes number college mention letter culture.
839,229,4,2023-04-20,Push though billion possible.
840,949,3,2024-11-05,Thank relationship court suddenly design act.
841,650,4,2024-06-17,Election team product discuss.
842,730,3,2024-06-22,Hold must prove chance table.
843,220,3,2023-12-19,Study evidence wrong may staff deep together.
844,564,4,2023-07-11,Effect maintain green past.
845,963,2,2023-04-06,History certainly rich these.
846,563,4,2023-04-13,Program break table kid glass.
847,103,4,2023-10-16,Strategy prevent less big amount campaign.
848,967,1,2024-06-22,Follow where author government feel now determine turn.
849,69,3,2023-11-13,Pressure add middle good.
850,162,5,2024-03-18,Ability mission make left that.
851,12,5,2023-02-05,Blue piece sit serve require ask use.
852,777,1,2023-08-21,Response face think particularly next however.
853,935,5,2024-12-29,International every reflect end.
854,592,4,2024-01-23,Skin decade student population support dark effort.
855,633,4,2023-07-14,Condition wonder rule piece box enjoy.
856,438,5,2024-06-27,Member kind lay any worry though vote.
857,406,1,2023-08-24,North prepare small throughout discover.
858,873,5,2024-08-19,Whatever new our church affect campaign hope.
859,489,3,2024-02-10,Movement officer agreement various chance.
860,439,3,2024-12-29,Continue company process rise trade film.
861,226,4,2025-02-23,Box realize the.
862,454,3,2024-07-01,After onto someone consumer develop care leader.
863,168,5,2024-05-15,Example toward natural best.
864,967,4,2024-07-09,Draw share any different possible court campaign.
865,18,4,2024-06-01,Shake why Congress right we threat.
866,205,2,2023-11-01,Town sit month grow.
867,663,5,2023-06-30,Year even left seat statement cost support commercial.
868,455,4,2025-03-13,East about night response walk.
869,229,1,2023-01-17,Them so skin surface little nation thing.
870,303,1,2025-02-15,Stuff relationship entire number.
871,793,2,2025-02-05,Everyone receive brother past door consider author when.
872,257,3,2025-03-25,Arm stage once husband.
873,516,1,2024-11-14,Race human single ask.
874,230,3,2023-10-20,Recognize most agree.
875,918,4,2024-04-18,Lead call consumer tough mother understand challenge.
876,385,2,2023-12-06,Onto study do nation whose whether.
877,371,4,2024-12-05,Fish certain everyone democratic.
878,431,5,2024-10-02,Market foreign new.
879,495,5,2024-12-09,East find us behavior.
880,1,1,2024-08-24,Two book deep girl change conference center understand.
881,472,1,2025-03-01,Free wide suggest entire treat.
882,656,5,2024-07-27,Science live skin ten do view.
883,104,1,2023-09-10,Already song try discuss charge.
884,594,3,2024-01-13,Staff paper PM central western.
885,645,1,2024-11-10,Part through floor sport build walk.
886,714,4,2024-05-30,Line clear deal once member message.
887,3,3,2025-03-21,Bad however body range high behind interest upon.
888,356,4,2024-08-31,Tv year person not.
889,416,5,2023-11-15,Try there American.
