ReviewID,OrderMenuID,RatingID,ReviewDate,ReviewBody
1,161,2,2024-03-31,Maybe laugh along former face well third.
2,110,5,2025-02-26,Until call tend sense explain special.
3,955,5,2024-09-13,Land receive son father page mind control.
4,959,3,2024-05-12,Similar trade all medical my particularly water.
5,927,3,2023-06-12,Since far trade policy.
6,431,4,2024-08-21,Must value traditional.
7,983,4,2024-02-25,Billion type break fall break position hold.
8,293,2,2024-06-20,Message minute state next by hand attention.
9,576,3,2025-01-28,Another clearly time service paper.
10,251,4,2023-06-15,Policy easy thank popular morning that people inside.
11,753,3,2023-06-30,Necessary plan movie surface what into.
12,262,2,2025-01-20,Reduce response part put relationship maybe feel.
13,677,4,2024-07-29,Away move Republican everything economy.
14,140,5,2024-05-30,Such part alone what.
15,465,2,2024-11-08,Heavy month debate talk.
16,714,5,2023-12-05,Or animal gun point four determine.
17,900,1,2025-02-06,Apply including resource source contain now city early.
18,856,5,2025-03-22,Treatment since require.
19,913,5,2023-11-09,Hospital study memory remain age wrong minute.
20,593,3,2023-06-07,Issue financial whom.
21,465,1,2024-04-09,Seat forget gun best style country.
22,256,2,2023-07-31,Day project your east.
23,56,1,2025-01-30,Mention institution senior political name value shake leader.
24,179,5,2023-10-01,Much one week skin international might near.
25,598,5,2023-09-22,Democratic themselves people buy plan.
26,289,3,2024-08-25,Hot several though with write condition.
27,55,5,2024-12-29,State attack enough chance five wall.
28,448,4,2024-05-12,Trouble life late thank.
29,581,4,2024-08-12,Surface or help dinner either discover standard.
30,336,1,2025-01-28,Significant dinner by increase.
31,845,5,2024-09-05,Try suggest degree seek investment sell.
32,490,2,2023-06-02,Make spring argue exactly score.
33,941,2,2024-01-19,Admit deal remember bar.
34,173,1,2023-04-28,Great radio tree manager husband.
35,354,2,2025-03-27,Issue writer issue force research increase room career.
36,172,1,2024-10-19,Reach final over southern similar moment natural.
37,683,3,2024-09-02,Down billion nice these record tough.
38,35,3,2024-05-06,Pretty effect school whose would.
39,162,2,2024-12-07,Small admit physical three.
40,235,5,2023-07-19,Word type exist use example stand power.
41,759,3,2024-02-25,Safe nice adult interesting experience.
42,817,2,2024-02-22,Animal money rock entire.
43,794,3,2024-10-08,Company whether few his kid account.
44,981,1,2023-11-26,Explain throughout program art project establish reduce move.
45,370,1,2023-10-10,Look at example some.
46,520,1,2024-04-01,War floor because response important turn ground.
47,635,5,2025-01-20,Enter civil minute in.
48,212,1,2024-01-11,Hear without go event wear.
49,465,2,2024-06-04,Ten table still record religious subject travel special.
50,474,3,2024-04-17,Ago agreement past chair edge threat down.
51,787,5,2024-07-27,Oil land happen explain feel.
52,115,3,2024-12-20,Message loss do marriage physical.
53,165,1,2024-11-14,Collection trip total friend to finally.
54,384,5,2025-01-14,We child we fine free.
55,560,3,2023-09-07,Issue country as build total front represent campaign.
56,186,2,2024-11-13,Yard free son wide surface.
57,550,5,2024-05-10,Expect find note should experience I happy poor.
58,271,3,2023-03-10,Debate discussion can explain really us marriage fish.
59,544,1,2023-03-03,Almost respond mission way four training actually a.
60,785,2,2024-12-18,Guy ball performance nothing national property cold.
61,573,3,2023-11-27,Factor number my general report road move require.
62,618,5,2023-07-12,Town south team drop great wide tax.
63,916,4,2024-08-24,Me total factor window onto medical.
64,87,5,2025-02-01,Sister wonder but pretty.
65,606,5,2024-12-13,Write five hair wall your.
66,686,5,2023-05-27,Beyond fund catch business.
67,912,1,2023-12-30,Organization table certain my nearly.
68,848,2,2024-10-25,Southern admit find determine Republican religious where.
69,736,2,2025-01-01,Pattern through change growth conference camera.
70,604,2,2024-08-27,Unit reveal available firm morning.
71,977,5,2023-02-26,People meeting indeed series husband easy speak.
72,984,5,2025-03-26,Wide show admit describe yourself.
73,308,4,2024-03-16,Somebody up history visit could decision.
74,851,4,2024-12-10,Public government similar forget.
75,618,4,2024-05-22,Skill exactly catch game step three.
76,367,4,2024-04-15,Worry animal what.
77,975,4,2023-05-04,Garden low society week compare themselves.
78,85,1,2024-07-25,Mouth music customer whether.
79,394,4,2023-11-28,Kind front house thought others role.
80,695,2,2023-07-19,Quite protect marriage future.
81,743,5,2025-01-01,Major grow quality for necessary what wrong.
82,342,5,2024-02-15,I child agency nothing network agreement.
83,640,3,2023-01-03,Their financial standard source soldier.
84,597,1,2025-02-25,Color same size safe.
85,69,2,2024-10-12,Drop wall responsibility turn.
86,768,3,2023-04-20,Resource occur reality far around third everybody.
87,724,1,2024-05-01,Someone raise the truth land claim too.
88,718,2,2023-10-24,Feeling bag special grow.
89,598,5,2023-08-18,Old money recognize field drug with low west.
90,283,5,2024-12-18,Describe experience everything sing most.
91,322,4,2023-01-21,Bring street chair girl.
92,857,5,2023-09-21,Mrs interview land tonight employee exactly by.
93,837,2,2023-03-04,North if challenge stay important improve hotel.
94,404,5,2023-06-11,Later dream shake assume send sea top.
95,673,4,2023-12-25,School play show agree appear agreement.
96,301,3,2024-01-22,Another someone field citizen.
97,306,3,2025-03-23,Meeting age sister manage mother look soon.
98,443,2,2023-03-02,Wrong what partner morning vote indicate view chair.
99,258,1,2023-02-17,Quality some degree different people national.
100,786,5,2023-10-28,Themselves everybody contain much message strategy money.
101,330,1,2023-05-04,Major else well see grow.
102,148,5,2023-07-25,Statement cup power enough medical.
103,244,2,2023-04-12,Address different billion student.
104,845,4,2024-02-23,Child past college.
105,599,2,2024-11-29,Off my sea building two usually.
106,7,2,2024-02-11,Town factor end billion alone form.
107,31,5,2024-05-21,Executive politics forward hit thus.
108,265,2,2024-04-21,Task TV walk pick agency trouble.
109,75,5,2023-12-27,Sound business too add institution hundred hard would.
110,992,4,2023-06-01,Other help affect.
111,380,1,2024-05-06,Major democratic seem future physical cup Republican test.
112,174,2,2025-03-06,Final director sound.
113,311,4,2023-01-01,Follow and property Congress.
114,894,4,2024-03-24,President two everybody view pressure civil.
115,160,2,2023-04-24,Top charge total view reach try fact.
116,898,5,2023-06-09,Level people director drug choice international girl.
117,900,2,2024-04-03,Example hour join wear head eight.
118,875,1,2024-08-12,Reflect many skin exactly.
119,756,4,2024-12-24,Season black view west pressure into edge.
120,539,1,2025-01-22,Bill agent social seek class success federal.
121,385,3,2024-12-06,First relate without tax.
122,508,3,2024-04-24,Voice campaign total job.
123,552,5,2023-04-16,Entire surface piece us.
124,375,1,2024-03-25,Majority practice look measure.
125,339,5,2024-03-16,Unit live imagine worry speech thousand.
126,262,3,2023-08-07,Performance it city performance production always.
127,506,1,2025-01-29,Sister weight she reality operation.
128,912,2,2023-11-30,Floor nature doctor police true.
129,10,2,2023-01-10,Wall choose successful discover dream music.
130,807,1,2024-02-25,Leg quite stage next.
131,71,1,2025-03-26,Prove either suddenly half recent.
132,515,4,2025-02-18,Try material view then must instead able.
133,603,5,2023-10-30,Most out relationship concern issue throw bed.
134,482,4,2023-07-02,One explain animal partner.
135,781,1,2024-12-14,Away pretty no PM author present Mr president.
136,500,3,2024-04-14,Capital message full father focus although.
137,614,4,2023-06-11,Later little including weight suffer professor.
138,704,4,2024-08-06,Dark seem teacher southern own fast paper.
139,355,4,2025-01-07,Against officer pass cause receive rate.
140,783,4,2024-09-14,Project idea attention decision west blue.
141,47,4,2023-01-25,Student per dark issue star.
142,128,1,2024-12-05,Understand side five son management detail give.
143,915,5,2023-10-29,Thing culture identify address science.
144,702,2,2023-08-04,Low adult simple difficult home.
145,309,5,2024-06-08,Clearly clear health report foot subject.
146,385,5,2024-07-14,Day every sister improve.
147,463,5,2024-10-06,Friend industry speak kid reality catch.
148,962,2,2023-04-14,Yes follow national seat make customer shoulder then.
149,45,1,2024-05-13,Lose resource tend oil far prepare.
150,767,2,2025-01-06,Simply remember speak beautiful small.
151,956,1,2024-02-21,Might focus happy government spend.
152,631,2,2024-04-17,Provide view daughter meet store race.
153,696,5,2024-02-12,Late type phone.
154,772,4,2023-05-19,This seven operation language score else physical heavy.
155,234,3,2023-06-21,It push treat.
156,434,4,2024-03-24,Music together information.
157,502,3,2023-02-05,Contain trial wonder think.
158,147,1,2023-05-28,Fund weight establish unit.
159,777,3,2025-01-25,Tell read any wear item effect.
160,658,5,2023-12-23,Doctor around western find.
161,976,5,2023-11-16,Middle tough artist training sister well.
162,352,2,2023-09-10,Laugh sound meeting up site quite though name.
163,926,2,2023-03-15,Music any single protect into music between responsibility.
164,46,1,2024-02-10,Million middle various.
165,761,2,2024-10-17,Happen thank feeling however run.
166,132,4,2023-08-26,Never hot again dog politics.
167,930,1,2024-08-11,Indeed up positive fear quickly American relationship miss.
168,516,4,2023-03-10,Second beautiful here today sell.
169,715,4,2023-11-23,Million along together loss oil know fact.
170,29,4,2024-06-06,Energy design build for.
171,59,5,2023-11-13,Stay through early as visit check water.
172,817,4,2024-03-07,Situation edge in difference toward.
173,708,1,2023-10-07,Sign could record sell every.
174,318,5,2024-05-09,Pm dream recent party.
175,683,2,2023-05-10,Many agent work lose teacher meeting himself.
176,79,3,2023-12-10,Far live occur accept.
177,473,5,2024-03-04,Various our step would.
178,496,4,2023-02-25,Situation sell relate already.
179,922,2,2023-10-17,Throughout buy probably show piece.
180,729,4,2024-01-29,Need blue health himself.
181,34,3,2024-04-23,Mean environment environment human also feeling politics.
182,849,3,2024-06-08,Position hundred future receive.
183,651,4,2023-06-11,Concern right result various.
184,508,1,2024-10-31,Really face whom turn push edge receive.
185,248,2,2023-02-15,Heavy standard cultural left speak state.
186,277,4,2024-11-29,She trip church big similar tough both.
187,718,3,2023-07-29,Skin red present big church want face.
188,872,5,2024-03-22,Yard analysis left budget tough quite sometimes.
189,434,4,2024-09-27,Far no fear news reveal act three.
190,44,4,2023-01-22,Concern my half nature theory participant.
191,690,3,2024-02-05,Rule only or.
192,255,3,2024-12-11,True style almost suffer stop.
193,109,1,2023-04-21,Piece body allow record between road financial.
194,424,3,2023-11-24,Only radio claim yes ago feel hour.
195,101,3,2024-12-28,Customer anyone able easy.
196,227,2,2025-03-25,Brother energy practice husband miss.
197,680,4,2024-12-20,East teacher leave probably.
198,306,3,2023-12-26,Consumer purpose street read dog some.
199,13,2,2023-02-03,Us study common ten store hear.
200,765,3,2024-11-10,Figure PM treatment list executive throw.
201,500,4,2023-07-09,Form natural be sister hospital dinner last.
202,602,3,2024-02-07,Sound outside want right cell.
203,633,3,2023-03-08,Accept record speech worker ago.
204,131,5,2023-09-01,Music rather several together end continue.
205,822,5,2023-09-21,Baby history whose conference hear.
206,702,2,2023-01-31,Often mind large.
207,764,3,2024-12-19,Condition so blue.
208,90,2,2024-09-30,These six service human.
209,395,4,2024-04-27,Various pattern cell situation series world two.
210,907,5,2023-08-20,Into describe power occur.
211,275,5,2023-04-06,Republican in space follow policy.
212,359,1,2023-05-19,Sort rule color manage marriage tough.
213,493,1,2023-06-08,Well want discussion week laugh with act.
214,332,5,2025-03-22,Crime establish clear before produce.
215,864,3,2025-02-28,Happen special hotel like important town.
216,182,1,2024-11-19,Teacher simply measure save main.
217,500,1,2023-02-26,Green seek campaign those where economy.
218,354,1,2024-12-30,Design leg affect day wear outside few.
219,296,3,2024-03-18,Policy follow peace simple management.
220,664,4,2024-01-29,Appear successful talk option husband include.
221,184,4,2024-03-25,Space individual you memory.
222,735,2,2024-03-21,Several start discover court.
223,515,2,2024-02-20,Term whole shoulder public yourself box.
224,729,5,2023-11-27,Meeting down road behavior eat prevent training.
225,944,3,2023-10-21,Season explain prevent exactly behind.
226,683,1,2024-11-02,Could effect both several character piece.
227,895,3,2023-01-05,Herself dark rule simple image itself enter.
228,207,4,2023-11-29,First recognize treatment process behind big that direction.
229,891,4,2023-08-28,She major quality because continue class.
230,129,3,2025-01-23,Place effort field send artist stock.
231,779,4,2024-10-12,Each and beyond.
232,576,4,2023-07-03,Toward leg hotel peace go heavy type.
233,773,1,2023-10-12,Hot social way.
234,410,3,2023-06-10,Feeling give my program realize.
235,502,1,2024-10-04,Interview write artist down certain apply admit ability.
236,704,4,2024-10-29,Rate anything then reach baby.
237,921,5,2023-04-27,College as light possible ball method.
238,515,1,2024-12-09,Spring statement night president.
239,347,5,2024-02-26,Past hair must instead year we.
240,943,5,2024-08-01,Benefit thus mention else trade.
241,93,2,2023-10-12,Certainly generation minute recently mother.
242,983,5,2023-08-15,Including history others cultural animal light grow bed.
243,364,2,2023-12-09,Least evidence phone generation more figure capital.
244,697,1,2023-08-18,Window PM remain these mission.
245,54,5,2024-12-19,Today they stand long ten change.
246,434,2,2023-06-20,Indeed only anyone significant suggest.
247,930,3,2024-05-27,Ahead what spend blue.
248,906,4,2025-02-02,Scientist together surface entire new claim character.
249,401,3,2024-03-20,Wife hot war most general glass.
250,534,1,2023-03-17,Suddenly shake interview season second occur anyone.
251,958,2,2024-04-22,Have discuss apply father memory.
252,521,4,2024-07-17,By expert some lose skin possible if.
253,72,3,2024-11-12,Write opportunity value threat modern.
254,356,5,2023-01-13,Both tend happy just.
255,368,4,2024-01-10,Television believe special already force.
256,761,1,2024-07-21,Whatever wind fall image.
257,480,2,2023-03-11,Hotel hospital cause south.
258,113,3,2023-09-03,Center direction turn lot.
259,710,3,2024-06-15,Challenge together understand painting role.
260,333,4,2023-02-02,Possible change dream than car accept price.
261,374,2,2023-12-07,Nor but argue report.
262,856,2,2024-04-08,Southern effort once full raise.
263,426,2,2023-08-18,Teach glass budget tonight.
264,694,5,2023-07-11,Small society include health.
265,427,5,2023-04-29,That traditional clear front information.
266,83,2,2023-08-17,Voice front away money project can cause.
267,881,2,2024-01-23,Page perform nor myself.
268,432,3,2025-03-05,Data pay already girl southern worker.
269,425,5,2024-03-30,General arrive fish drop.
270,574,3,2024-07-25,Reach film seven attention chair window authority.
271,597,2,2025-02-14,Seat development really security pass environment.
272,913,3,2024-10-31,Suddenly picture sit property.
273,309,3,2024-07-27,Manage have provide treat run how.
274,45,4,2024-01-30,Never tell truth fall.
275,580,1,2023-10-31,Doctor toward everyone choice character believe.
276,246,3,2024-01-01,From wrong price study.
277,431,1,2023-12-07,Color different decide actually.
278,957,3,2024-01-17,Surface little health true second manage.
279,765,3,2023-05-17,Hold offer long us may.
280,245,4,2024-02-23,Reach water interest expert knowledge family.
281,398,5,2023-04-23,Eye establish cut sing lawyer audience.
282,257,2,2023-11-19,Wind national hospital none boy better.
283,418,4,2023-05-03,Laugh life people it past.
284,655,2,2023-01-31,Value laugh help each general stop degree.
285,15,5,2024-03-27,Buy data process find step stand.
286,350,5,2023-01-12,Race respond also suddenly.
287,583,1,2025-01-22,Agent however kid street energy many little.
288,904,2,2023-12-23,Among soldier experience all trade it evidence offer.
289,380,2,2024-11-12,Oil mission teach suffer spring.
290,322,3,2024-01-10,Image him believe attention old only much.
291,123,2,2024-05-24,Blue employee threat our can.
292,713,4,2023-01-09,Tell effort science myself follow weight.
293,424,1,2024-01-08,Issue bad might soldier nothing city wrong scene.
294,120,4,2023-06-10,Reveal drug exactly become attack.
295,885,1,2024-09-29,Nice everyone defense paper base though crime.
296,929,5,2024-01-18,Return we explain firm.
297,74,4,2023-02-06,Loss war Democrat before option.
298,225,2,2024-07-29,Establish down whom.
299,213,5,2024-02-13,Pull she wide hot subject weight available.
300,602,4,2024-06-28,By reality best woman physical property relate fly.
301,343,5,2024-05-19,Hit painting relationship more know arrive son.
302,426,4,2025-03-27,Magazine drop board body there green threat.
303,193,3,2023-10-01,Drive before cover father price human.
304,192,4,2023-10-24,These fly skin six class.
305,135,4,2023-04-05,Enough long police development middle.
306,268,2,2023-05-10,Economy half item exist will.
307,929,2,2025-03-01,Task degree door evidence old.
308,381,4,2023-07-15,Upon society message camera expect no first usually.
309,954,1,2023-12-18,Although price teacher both lead herself.
310,77,2,2024-11-20,Hear new pull TV of choice.
311,524,5,2024-08-23,After attention but pick.
312,153,3,2024-08-19,Success lead series remember.
313,383,3,2024-12-16,Increase though film least.
314,405,4,2024-07-13,Magazine of easy point never author lay.
315,622,5,2024-08-26,So chance ok often among lead.
316,414,4,2024-03-20,If former here nor.
317,69,2,2024-11-02,Week wonder none part material why degree.
318,608,4,2023-06-27,Player part building white piece.
319,132,5,2023-11-22,Rich respond set pick save cold go.
320,84,1,2024-07-28,Unit Republican to thank there.
321,972,5,2024-02-11,Talk note company apply so send.
322,149,2,2024-09-03,Or gun hand middle fact Republican.
323,657,1,2023-06-04,Himself conference listen.
324,727,5,2024-02-13,Everybody book world prove lot idea.
325,440,2,2023-09-10,Prevent evening call talk write.
326,926,2,2023-11-18,Book artist Congress Democrat activity deal.
327,582,5,2024-03-17,Serve sure base father.
328,462,3,2023-01-26,Sense computer bad test traditional federal.
329,866,1,2023-02-05,Require school sense water.
330,757,2,2024-01-28,Often history program fire.
331,914,2,2024-10-25,At machine face evening knowledge our ago drug.
332,320,2,2023-07-11,Million everybody law want sign.
333,572,5,2023-12-09,Example take effort begin west recent identify.
334,860,1,2024-11-12,Indicate space item pretty product.
335,779,4,2023-12-21,Policy page who executive window card.
336,717,2,2023-03-06,Fire ever across.
337,899,3,2024-01-10,Fine current activity worry public animal.
338,398,2,2023-03-31,Pressure result system now possible whose agree painting.
339,594,5,2024-05-09,Specific ability deep teach trade available sure.
340,498,3,2025-03-30,Where list wear value west however.
341,567,1,2025-02-18,What year expert deal identify also your.
342,312,5,2024-08-24,Easy result Democrat let but find share doctor.
343,539,3,2025-02-12,Action break responsibility.
344,494,3,2024-04-02,Why through focus something.
345,585,3,2024-12-12,Benefit environment special budget offer station goal call.
346,772,3,2024-01-07,Bar recently between run.
347,848,3,2023-03-19,Keep relate situation attention.
348,520,1,2024-08-22,Town no light decade believe car view truth.
349,643,5,2023-07-25,Air suffer next ground operation law.
350,622,5,2024-05-01,Cold evidence watch close visit public.
351,419,2,2024-06-17,Mission firm father east free traditional though.
352,758,3,2023-09-14,Song response something trip beat machine.
353,203,5,2024-08-25,Sure yourself he arrive worker affect.
354,88,5,2023-12-09,Professor leader region suffer plan should.
355,586,2,2023-08-12,Bag morning gun myself approach.
356,436,1,2023-03-10,Certainly account follow political.
357,953,3,2023-06-26,Accept skill difficult together include bar store believe.
358,230,1,2024-04-10,Trouble enough rate arm say.
359,60,1,2025-04-01,Present have several political miss growth discussion.
360,356,2,2023-07-22,Across almost onto now others although fill.
361,166,3,2023-10-01,City person effort not indeed.
362,507,4,2025-02-22,Know reflect go plant clearly.
363,643,2,2023-09-15,Data central finally fact chance together personal.
364,53,1,2023-12-09,Trial himself plant body.
365,267,2,2024-06-26,System marriage course sport although woman.
366,726,2,2024-10-23,So possible thank sure its admit use analysis.
367,210,5,2023-01-21,Race theory skill lay wide understand.
368,399,2,2024-11-16,Walk the system bad walk carry.
369,585,4,2023-03-09,Common market catch little guess.
370,897,4,2024-10-01,A early decide worker without.
371,851,2,2024-05-19,Trip industry movement relate share long sing.
372,188,3,2024-03-09,How stage win oil these.
373,185,3,2024-12-05,Staff myself investment letter enjoy suddenly.
374,781,5,2023-06-13,Learn determine financial market away human professional.
375,356,1,2023-04-25,Force hear whether fear clear.
376,834,3,2023-07-22,Us risk others chance new experience.
377,577,4,2023-10-03,Kid politics race water camera answer answer page.
378,750,5,2024-03-02,Physical morning discussion forget social describe occur.
379,81,5,2025-02-20,Finish concern Congress.
380,433,4,2023-04-02,Tree fire order pick.
381,257,3,2024-02-11,Happen bag matter throughout draw.
382,137,4,2023-10-11,Question instead worry first choice industry level.
383,241,1,2024-11-30,I check member main final TV thank.
384,5,4,2024-01-21,Nearly enter Congress former different something.
385,964,5,2023-03-20,Pick line song kitchen.
386,124,5,2023-11-24,Treatment major either box.
387,138,4,2023-06-02,Nor production guy example firm.
388,495,2,2024-12-17,Give finish half certain style produce prove.
389,289,1,2024-03-17,Usually theory should.
390,416,2,2025-02-27,Half peace probably yet drop bank responsibility name.
391,601,2,2023-12-10,Information body experience increase thus measure board.
392,939,3,2023-09-12,Tonight ok interest want significant simply.
393,736,1,2023-06-04,Determine huge sign find assume field catch.
394,785,5,2023-05-25,Newspaper challenge back perform upon approach.
395,11,4,2023-05-11,Stand guess really card though activity source ever.
396,114,2,2024-11-22,Phone expert discuss prepare eye person couple.
397,500,5,2025-03-20,Senior throughout including model.
398,400,4,2023-09-25,Detail address site see seven dream.
399,209,5,2025-03-03,Bar for send ready our.
400,997,3,2024-04-05,Read raise imagine country travel.
401,111,4,2023-02-10,Forward serve significant.
402,772,3,2025-01-29,Bad money thank stock son thousand wish.
403,621,2,2024-11-23,Begin human conference trade.
404,93,3,2024-06-06,Alone race opportunity cost remain example range.
405,585,4,2023-04-08,Race whole common station Democrat beautiful door.
406,846,4,2023-01-03,Compare clearly reflect alone want.
407,515,1,2023-04-20,Hot far job yet consumer street together.
408,883,5,2023-10-04,Part sort subject success society difficult thus.
409,436,5,2024-06-24,Some ball size possible.
410,250,2,2024-12-08,Leg white lose.
411,478,2,2023-04-21,Lawyer off book concern red.
412,699,1,2023-06-21,Young hot ten available address.
413,668,5,2024-08-19,Pressure standard name on call source music.
414,18,2,2025-01-07,Involve identify short floor mother see.
415,857,3,2024-03-29,Heart form phone suggest member.
416,537,5,2023-03-16,Resource allow service design.
417,372,4,2024-09-22,Maintain stay camera.
418,684,2,2024-07-25,Purpose from pull good create school.
419,355,5,2024-07-02,Father prepare add light result pretty often almost.
420,232,5,2023-10-07,Letter pressure treatment beautiful war.
421,832,3,2023-02-14,From avoid team strong book fear story.
422,398,4,2025-03-03,Pay report candidate entire run other some.
423,5,4,2024-07-22,Reduce history pull yard also public kid.
424,431,2,2024-09-07,Chair other crime option benefit season consider trouble.
425,808,4,2024-11-05,Growth until change center.
426,154,2,2023-09-15,Become purpose community word activity beautiful one.
427,178,1,2023-09-10,Dog performance like world himself power manage city.
428,198,4,2024-04-03,Right bank agent thank receive military.
429,13,2,2025-02-25,Professor one somebody perform someone president reveal must.
430,424,2,2025-03-20,Debate page too.
431,194,1,2023-11-06,Free manager buy toward according.
432,357,5,2024-07-21,Kind side respond want rate.
433,428,3,2024-11-13,Oil natural rather.
434,482,4,2025-02-21,Think compare others success knowledge project.
435,212,1,2024-10-25,This reflect training risk any.
436,657,1,2025-01-14,Suffer little fill once within tend.
437,755,4,2025-01-20,Do leader very day article agreement age.
438,362,2,2023-05-03,Any hard suggest ago.
439,503,4,2023-05-20,Land sort wall soldier agreement medical.
440,466,2,2024-02-16,Because let fly hospital beat relationship.
441,383,5,2024-06-11,Analysis price executive.
442,401,1,2023-04-23,She question less technology physical conference charge.
443,636,2,2024-05-14,Heavy event more behavior glass imagine about office.
